{"receipt_id":"receipt-push-001","effect_id":"effect-push-001","effect_type":"git.push","status":"SUCCEEDED","executed_by":"git-gateway-001","started_at":"2026-07-25T00:21:00Z","completed_at":"2026-07-25T00:21:03Z","repository_id":"GDS-DOCS","branch":"main","remote":"origin","head_before":"2222222222222222222222222222222222222222","head_after":"2222222222222222222222222222222222222222","commit_id":"2222222222222222222222222222222222222222","tag_name":null,"idempotency_key":"GDS-DOCS:push:2222","request_digest":"sha256:1212121212121212121212121212121212121212121212121212121212121212","result_digest":"sha256:3434343434343434343434343434343434343434343434343434343434343434","evidence":{"remote_ref":"refs/heads/main","reachable":true},"error":null}
