{"receipt_id":"receipt-commit-001","effect_id":"effect-commit-001","effect_type":"git.commit","status":"SUCCEEDED","executed_by":"git-gateway-001","started_at":"2026-07-25T00:11:00Z","completed_at":"2026-07-25T00:11:02Z","repository_id":"GDS-DOCS","branch":"main","remote":null,"head_before":"1111111111111111111111111111111111111111","head_after":"2222222222222222222222222222222222222222","commit_id":"2222222222222222222222222222222222222222","tag_name":null,"idempotency_key":"GDS-DOCS:commit:cccc","request_digest":"sha256:eeeeeeeeeeeeeeeeeeeeeeeeeeeeeeeeeeeeeeeeeeeeeeeeeeeeeeeeeeeeeeee","result_digest":"sha256:ffffffffffffffffffffffffffffffffffffffffffffffffffffffffffffffff","evidence":{"subject":"docs: add demo"},"error":null}
